[
	{
		"remoteUniqueID": {
			"remoteSystem": "http://luna.folger.edu/",
			"remoteID": "139065"
		},
		"format": [
			"image"
		],
		"searchHandling": "exclude",
		"sortOrder": 1,
		"fileInfo": {
			"fileURL": "http://luna.folger.edu:80/MediaManager/srvr?mediafile=/JP2K/FOLGERCM1~6~6/640/139065.jp2&width=4686&height=6546",
			"encodingFormat": "jp2"
		},
		"title": {
			"briefTitle": "Hyāmaleṭa : (Dinmarkira yuvarāja) / Sekspiỵara ; Manomohana Rāya anūdita."
		},
		"creator": {
			"name": "Shakespeare, William, 1564-1616."
		}
	},
	{
		"remoteUniqueID": {
			"remoteSystem": "http://luna.folger.edu/",
			"remoteID": "139066"
		},
		"format": [
			"image"
		],
		"searchHandling": "exclude",
		"sortOrder": 2,
		"fileInfo": {
			"fileURL": "http://luna.folger.edu:80/MediaManager/srvr?mediafile=/JP2K/FOLGERCM1~6~6/640/139066.jp2&width=6426&height=4835",
			"encodingFormat": "jp2"
		},
		"title": {
			"briefTitle": "Hyāmaleṭa : (Dinmarkira yuvarāja) / Sekspiỵara ; Manomohana Rāya anūdita."
		},
		"creator": {
			"name": "Shakespeare, William, 1564-1616."
		}
	},
	{
		"remoteUniqueID": {
			"remoteSystem": "http://luna.folger.edu/",
			"remoteID": "139067"
		},
		"format": [
			"image"
		],
		"searchHandling": "exclude",
		"sortOrder": 3,
		"fileInfo": {
			"fileURL": "http://luna.folger.edu:80/MediaManager/srvr?mediafile=/JP2K/FOLGERCM1~6~6/640/139067.jp2&width=6345&height=4762",
			"encodingFormat": "jp2"
		},
		"title": {
			"briefTitle": "Hyāmaleṭa : (Dinmarkira yuvarāja) / Sekspiỵara ; Manomohana Rāya anūdita."
		},
		"creator": {
			"name": "Shakespeare, William, 1564-1616."
		}
	},
	{
		"remoteUniqueID": {
			"remoteSystem": "http://luna.folger.edu/",
			"remoteID": "139068"
		},
		"format": [
			"image"
		],
		"searchHandling": "exclude",
		"sortOrder": 4,
		"fileInfo": {
			"fileURL": "http://luna.folger.edu:80/MediaManager/srvr?mediafile=/JP2K/FOLGERCM1~6~6/640/139068.jp2&width=6374&height=4777",
			"encodingFormat": "jp2"
		},
		"title": {
			"briefTitle": "Hyāmaleṭa : (Dinmarkira yuvarāja) / Sekspiỵara ; Manomohana Rāya anūdita."
		},
		"creator": {
			"name": "Shakespeare, William, 1564-1616."
		}
	},
	{
		"remoteUniqueID": {
			"remoteSystem": "http://luna.folger.edu/",
			"remoteID": "139069"
		},
		"format": [
			"image"
		],
		"searchHandling": "exclude",
		"sortOrder": 5,
		"fileInfo": {
			"fileURL": "http://luna.folger.edu:80/MediaManager/srvr?mediafile=/JP2K/FOLGERCM1~6~6/640/139069.jp2&width=6404&height=4782",
			"encodingFormat": "jp2"
		},
		"title": {
			"briefTitle": "Hyāmaleṭa : (Dinmarkira yuvarāja) / Sekspiỵara ; Manomohana Rāya anūdita."
		},
		"creator": {
			"name": "Shakespeare, William, 1564-1616."
		}
	},
	{
		"remoteUniqueID": {
			"remoteSystem": "http://luna.folger.edu/",
			"remoteID": "139070"
		},
		"format": [
			"image"
		],
		"searchHandling": "exclude",
		"sortOrder": 6,
		"fileInfo": {
			"fileURL": "http://luna.folger.edu:80/MediaManager/srvr?mediafile=/JP2K/FOLGERCM1~6~6/640/139070.jp2&width=6396&height=4796",
			"encodingFormat": "jp2"
		},
		"title": {
			"briefTitle": "Hyāmaleṭa : (Dinmarkira yuvarāja) / Sekspiỵara ; Manomohana Rāya anūdita."
		},
		"creator": {
			"name": "Shakespeare, William, 1564-1616."
		}
	},
	{
		"remoteUniqueID": {
			"remoteSystem": "http://luna.folger.edu/",
			"remoteID": "139071"
		},
		"format": [
			"image"
		],
		"searchHandling": "exclude",
		"sortOrder": 7,
		"fileInfo": {
			"fileURL": "http://luna.folger.edu:80/MediaManager/srvr?mediafile=/JP2K/FOLGERCM1~6~6/640/139071.jp2&width=6430&height=4809",
			"encodingFormat": "jp2"
		},
		"title": {
			"briefTitle": "Hyāmaleṭa : (Dinmarkira yuvarāja) / Sekspiỵara ; Manomohana Rāya anūdita."
		},
		"creator": {
			"name": "Shakespeare, William, 1564-1616."
		}
	},
	{
		"remoteUniqueID": {
			"remoteSystem": "http://luna.folger.edu/",
			"remoteID": "139072"
		},
		"format": [
			"image"
		],
		"searchHandling": "exclude",
		"sortOrder": 8,
		"fileInfo": {
			"fileURL": "http://luna.folger.edu:80/MediaManager/srvr?mediafile=/JP2K/FOLGERCM1~6~6/640/139072.jp2&width=6437&height=4808",
			"encodingFormat": "jp2"
		},
		"title": {
			"briefTitle": "Hyāmaleṭa : (Dinmarkira yuvarāja) / Sekspiỵara ; Manomohana Rāya anūdita."
		},
		"creator": {
			"name": "Shakespeare, William, 1564-1616."
		}
	},
	{
		"remoteUniqueID": {
			"remoteSystem": "http://luna.folger.edu/",
			"remoteID": "139073"
		},
		"format": [
			"image"
		],
		"searchHandling": "exclude",
		"sortOrder": 9,
		"fileInfo": {
			"fileURL": "http://luna.folger.edu:80/MediaManager/srvr?mediafile=/JP2K/FOLGERCM1~6~6/640/139073.jp2&width=6464&height=4849",
			"encodingFormat": "jp2"
		},
		"title": {
			"briefTitle": "Hyāmaleṭa : (Dinmarkira yuvarāja) / Sekspiỵara ; Manomohana Rāya anūdita."
		},
		"creator": {
			"name": "Shakespeare, William, 1564-1616."
		}
	},
	{
		"remoteUniqueID": {
			"remoteSystem": "http://luna.folger.edu/",
			"remoteID": "139074"
		},
		"format": [
			"image"
		],
		"searchHandling": "exclude",
		"sortOrder": 10,
		"fileInfo": {
			"fileURL": "http://luna.folger.edu:80/MediaManager/srvr?mediafile=/JP2K/FOLGERCM1~6~6/640/139074.jp2&width=6444&height=4802",
			"encodingFormat": "jp2"
		},
		"title": {
			"briefTitle": "Hyāmaleṭa : (Dinmarkira yuvarāja) / Sekspiỵara ; Manomohana Rāya anūdita."
		},
		"creator": {
			"name": "Shakespeare, William, 1564-1616."
		}
	},
	{
		"remoteUniqueID": {
			"remoteSystem": "http://luna.folger.edu/",
			"remoteID": "139075"
		},
		"format": [
			"image"
		],
		"searchHandling": "exclude",
		"sortOrder": 11,
		"fileInfo": {
			"fileURL": "http://luna.folger.edu:80/MediaManager/srvr?mediafile=/JP2K/FOLGERCM1~6~6/640/139075.jp2&width=6425&height=4817",
			"encodingFormat": "jp2"
		},
		"title": {
			"briefTitle": "Hyāmaleṭa : (Dinmarkira yuvarāja) / Sekspiỵara ; Manomohana Rāya anūdita."
		},
		"creator": {
			"name": "Shakespeare, William, 1564-1616."
		}
	},
	{
		"remoteUniqueID": {
			"remoteSystem": "http://luna.folger.edu/",
			"remoteID": "139076"
		},
		"format": [
			"image"
		],
		"searchHandling": "exclude",
		"sortOrder": 12,
		"fileInfo": {
			"fileURL": "http://luna.folger.edu:80/MediaManager/srvr?mediafile=/JP2K/FOLGERCM1~6~6/640/139076.jp2&width=6471&height=4857",
			"encodingFormat": "jp2"
		},
		"title": {
			"briefTitle": "Hyāmaleṭa : (Dinmarkira yuvarāja) / Sekspiỵara ; Manomohana Rāya anūdita."
		},
		"creator": {
			"name": "Shakespeare, William, 1564-1616."
		}
	},
	{
		"remoteUniqueID": {
			"remoteSystem": "http://luna.folger.edu/",
			"remoteID": "139077"
		},
		"format": [
			"image"
		],
		"searchHandling": "exclude",
		"sortOrder": 13,
		"fileInfo": {
			"fileURL": "http://luna.folger.edu:80/MediaManager/srvr?mediafile=/JP2K/FOLGERCM1~6~6/640/139077.jp2&width=6485&height=4815",
			"encodingFormat": "jp2"
		},
		"title": {
			"briefTitle": "Hyāmaleṭa : (Dinmarkira yuvarāja) / Sekspiỵara ; Manomohana Rāya anūdita."
		},
		"creator": {
			"name": "Shakespeare, William, 1564-1616."
		}
	},
	{
		"remoteUniqueID": {
			"remoteSystem": "http://luna.folger.edu/",
			"remoteID": "139078"
		},
		"format": [
			"image"
		],
		"searchHandling": "exclude",
		"sortOrder": 14,
		"fileInfo": {
			"fileURL": "http://luna.folger.edu:80/MediaManager/srvr?mediafile=/JP2K/FOLGERCM1~6~6/640/139078.jp2&width=6492&height=4782",
			"encodingFormat": "jp2"
		},
		"title": {
			"briefTitle": "Hyāmaleṭa : (Dinmarkira yuvarāja) / Sekspiỵara ; Manomohana Rāya anūdita."
		},
		"creator": {
			"name": "Shakespeare, William, 1564-1616."
		}
	},
	{
		"remoteUniqueID": {
			"remoteSystem": "http://luna.folger.edu/",
			"remoteID": "139079"
		},
		"format": [
			"image"
		],
		"searchHandling": "exclude",
		"sortOrder": 15,
		"fileInfo": {
			"fileURL": "http://luna.folger.edu:80/MediaManager/srvr?mediafile=/JP2K/FOLGERCM1~6~6/640/139079.jp2&width=6512&height=4795",
			"encodingFormat": "jp2"
		},
		"title": {
			"briefTitle": "Hyāmaleṭa : (Dinmarkira yuvarāja) / Sekspiỵara ; Manomohana Rāya anūdita."
		},
		"creator": {
			"name": "Shakespeare, William, 1564-1616."
		}
	},
	{
		"remoteUniqueID": {
			"remoteSystem": "http://luna.folger.edu/",
			"remoteID": "139080"
		},
		"format": [
			"image"
		],
		"searchHandling": "exclude",
		"sortOrder": 16,
		"fileInfo": {
			"fileURL": "http://luna.folger.edu:80/MediaManager/srvr?mediafile=/JP2K/FOLGERCM1~6~6/640/139080.jp2&width=6526&height=4809",
			"encodingFormat": "jp2"
		},
		"title": {
			"briefTitle": "Hyāmaleṭa : (Dinmarkira yuvarāja) / Sekspiỵara ; Manomohana Rāya anūdita."
		},
		"creator": {
			"name": "Shakespeare, William, 1564-1616."
		}
	},
	{
		"remoteUniqueID": {
			"remoteSystem": "http://luna.folger.edu/",
			"remoteID": "139081"
		},
		"format": [
			"image"
		],
		"searchHandling": "exclude",
		"sortOrder": 17,
		"fileInfo": {
			"fileURL": "http://luna.folger.edu:80/MediaManager/srvr?mediafile=/JP2K/FOLGERCM1~6~6/640/139081.jp2&width=6532&height=4802",
			"encodingFormat": "jp2"
		},
		"title": {
			"briefTitle": "Hyāmaleṭa : (Dinmarkira yuvarāja) / Sekspiỵara ; Manomohana Rāya anūdita."
		},
		"creator": {
			"name": "Shakespeare, William, 1564-1616."
		}
	},
	{
		"remoteUniqueID": {
			"remoteSystem": "http://luna.folger.edu/",
			"remoteID": "139082"
		},
		"format": [
			"image"
		],
		"searchHandling": "exclude",
		"sortOrder": 18,
		"fileInfo": {
			"fileURL": "http://luna.folger.edu:80/MediaManager/srvr?mediafile=/JP2K/FOLGERCM1~6~6/640/139082.jp2&width=6553&height=4816",
			"encodingFormat": "jp2"
		},
		"title": {
			"briefTitle": "Hyāmaleṭa : (Dinmarkira yuvarāja) / Sekspiỵara ; Manomohana Rāya anūdita."
		},
		"creator": {
			"name": "Shakespeare, William, 1564-1616."
		}
	},
	{
		"remoteUniqueID": {
			"remoteSystem": "http://luna.folger.edu/",
			"remoteID": "139083"
		},
		"format": [
			"image"
		],
		"searchHandling": "exclude",
		"sortOrder": 19,
		"fileInfo": {